i_category,i_class,i_current_price,i_item_desc,i_item_id,itemrevenue,revenueratio
Electronics,audio,2.01,Exceptionally fresh carers should make in a eyes. Very efficient associations wo,AAAAAAAAABOLAAAA,229.24,0.022905031427273816
Electronics,audio,1.53,So,AAAAAAAAADCMAAAA,6109.02,0.6103965062373247
Electronics,audio,2.1,Quick sources ought to run co,AAAAAAAAADLIBAAA,4100.9,0.40975066908090735
Electronics,audio,3.81,"Knees must not stay most young decisions. Private, famous cities wear; dark facilities can talk manufacturers. Rules should want se",AAAAAAAAAFFIBAAA,5915.08,0.5910185538947775
Electronics,audio,2.23,Systems ask there usually white scores. Easily wet b,AAAAAAAAAFOCBAAA,2311.91,0.23099969990851776
Electronics,audio,8.52,Distinct artists will not ea,AAAAAAAAAGAEAAAA,1117.44,0.11165153689623475
Electronics,audio,0.79,Completely outer houses remain years. Dead police should not go. Hours make good police. Databases help really surprising days. ,AAAAAAAAAIINAAAA,3790.5,0.3787363532763977
Electronics,audio,1.97,"Local, responsible problems know phrases; difficulties work thick popular prices. Current advantages succeed then always old",AAAAAAAAAJMKAAAA,49.77,0.004972881757701177
Electronics,audio,38.9,"Hot, entire changes borrow to a dogs. Other recommendations might get inner relations; industrial waters could appreciate. Only legal words keep exp",AAAAAAAAAKNPAAAA,2073.21,0.20714945125343898
Electronics,audio,4.51,Far discipli,AAAAAAAAALAHBAAA,137.6,0.013748614222617682
Electronics,audio,2.68,Goods handle casual pictures. Other problems think; international,AAAAAAAAAMHHAAAA,1289.25,0.12881832039614713
Electronics,audio,3.08,Ill entries should continue even divine dogs. Republics enquire. Public hands allow daughters. Hand,AAAAAAAAAOHDBAAA,8601.49,0.8594372656228471
Electronics,audio,7.8,"Small times find groups. Other, wide managers seem physical countri",AAAAAAAAAPFLAAAA,3328.08,0.3325326164390222
Electronics,audio,0.49,Negotiations could underline to a rounds; windows add pounds. Sections ought to give committees. Old groups like. Years tell so,AAAAAAAABDGJAAAA,12218.75,1.2208639537253618
Electronics,audio,8.33,"Groups afford perhaps. Major, net hundreds see swiftly. Industrial dreams ex",AAAAAAAABFIEBAAA,11674.29,1.1664630053267686
Electronics,audio,1.22,Scottish audiences should form automatically rates. Members lead considerab,AAAAAAAABGCKAAAA,3867.85,0.3864649529138939
Electronics,audio,6.41,"Additional, full trials ought to work inside excessive groups. Strong, united flames could turn creditors; neither othe",AAAAAAAABHBABAAA,8301.42,0.829455095057579
Electronics,audio,2.17,"Private, speci",AAAAAAAABIICAAAA,103.96,0.010387397780402138
Electronics,audio,1.47,"Usual allowances enter at least to a homes. Benefits travel statements. Videos ought to shore finally big, widespread differences. Tall, roya",AAAAAAAABLMHAAAA,1630.53,0.16291808102038377
Electronics,audio,5.08,Short members operate reports. Virtually old prices migh,AAAAAAAABPJDAAAA,17554.09,1.75395647848191
Electronics,audio,4.74,"Immediate, long-term differences suggest even home ready reports. Resources shall follow completely out of the communities; c",AAAAAAAACACIBAAA,19.04,0.0019024245261529118
Electronics,audio,3.86,Effects t,AAAAAAAACAEEAAAA,14814.91,1.4802651332325647
Electronics,audio,1.72,Appointments look. Outside sexual successes divide sufficiently just certain members. New chemicals collect already; objecti,AAAAAAAACBFGAAAA,8325.58,0.8318690959268991
Electronics,audio,1.62,"Demonstrations help. Good years should not give corporate elections. Yellow, dead games used to admit mainly matters. Appointed, afraid programmes may in",AAAAAAAACDJFAAAA,15223.84,1.5211242961254068
Electronics,audio,69.38,"Still urban legs would see delightful numbers. Kinds contend almost. Trousers draw animals; developments fight at a insects. Pure, socia",AAAAAAAACELFAAAA,74.4,0.007433843736647933
Electronics,audio,3.71,"Old findings halt in a candidates. Whole, small bags must not work about other boots. Other pictures might not buy stones. Urgent problems shall not s",AAAAAAAACFCCAAAA,2578.13,0.25759967140812007
Electronics,audio,6.79,Strong,AAAAAAAACGAIBAAA,5717.19,0.5712459283968574
Electronics,audio,4.54,Never splendid animals see more soft times. Offenders will extract only things. Very,AAAAAAAACGBKAAAA,453.73,0.045335455895554655
Electronics,audio,8.22,"Too important consequences see adjacent teams; very individual provisions should prefer days. Realistic groups sound only good months; original, true operators suggest coins; m",AAAAAAAACGHEBAAA,10017.94,1.0009650607945535
Electronics,audio,3.72,"Huge, psychological children hurry just including the books. Cars cannot try. Quite other requirements manage from a humans. Much general scientist",AAAAAAAACGIGAAAA,1459.08,0.14578726773210035
Electronics,audio,1.69,"Alone, lucky resources aff",AAAAAAAACGPCAAAA,494.46,0.0494050856723513
Electronics,audio,1.57,"Tiny, only women curb safer by far possible prisoners. Brief words tell civil figures. Early, eastern votes should hear critical, additional hours. Personal, nuclear thoughts can",AAAAAAAACHLMAAAA,2570.04,0.25679134081901417
Electronics,audio,6.78,Plants phone loosely always square patients. Full results look previous regions. As unknown scientists would take often li,AAAAAAAACHNKAAAA,2298.0,0.22960985089807726
Electronics,audio,8.47,Shoes think groups. Too due accountants might not marry e,AAAAAAAACHPNAAAA,1760.51,0.1759053257635222
Electronics,audio,1.97,"Present, firm processes release high, total div",AAAAAAAACIMABAAA,591.36,0.05908706763580808
Electronics,audio,1.48,"Confidential, horrible forces happen also elections. Courses could not give surely soon additional hou",AAAAAAAACJMHBAAA,1017.28,0.101643824683027
Electronics,audio,3.77,Bands judge well in the light of a processes. More than unknown records promise nearly new commitments. Recently cold months like. Situ,AAAAAAAACJOFBAAA,798.12,0.07974595918136354
Electronics,audio,8.35,Perhaps similar officers talk for the holders; open folk shall u,AAAAAAAACKGLAAAA,702.9,0.07023183820550849
Electronics,audio,4.54,Departments could not understand surprisingly from a men. Short departments pay then poli,AAAAAAAACLHBBAAA,2431.44,0.24294280934187162
Electronics,audio,2.05,Enemies depend then great conte,AAAAAAAACMNNAAAA,2064.76,0.2063051504527041
Electronics,audio,92.28,Developments reside units. Slow significant,AAAAAAAACPDLAAAA,113.16,0.011306636522030646
Electronics,audio,3.2,"Effective minutes expect official, willing defendants. Violent applications trust particularly never technical ",AAAAAAAACPHLAAAA,2575.38,0.2573248989581768
Electronics,audio,4.93,Young theo,AAAAAAAADBGAAAAA,24.96,0.0024939346729399513
Electronics,audio,1.38,"Events will limit detailed years; weeks should not want very quite grateful directions. Poems would grip fashionable, statistical",AAAAAAAADDMABAAA,6.72,0.00067144395040691
Electronics,audio,6.44,"Green, charming things change much local days. Remote, northern items cannot end good, different children; important, video-taped pupils would enhance most. Oth",AAAAAAAADDMNAAAA,4179.05,0.4175592025220234
Electronics,audio,5.29,"Remaining, british roads will help championships. Immediately practical centres shall stop then just political friends; exhibitions raise barely only sufficient things. Only high victims add home be",AAAAAAAADHFGBAAA,6872.96,0.6867272936590292
Electronics,audio,4.06,"Other borders restore again national, educational programs; wild, new emotions expect. Close politicians cannot die young, administrative players. Satisfactory, silver consequences ",AAAAAAAADHMAAAAA,415.47,0.04151262173743436
Electronics,audio,0.14,Simply clear weekends take reaso,AAAAAAAADICCBAAA,884.94,0.08842077521920996
Electronics,audio,9.56,"Services involve sure sources. Well urban circumstances eliminate considerable, fine teeth; too free days leave; young clothes used to expel then misleadi",AAAAAAAADIKABAAA,10034.44,1.0026136954942135
Electronics,audio,6.35,"Medium, original plants proceed envir",AAAAAAAADJPNAAAA,4446.57,0.44428906645250804
Electronics,audio,7.95,Correct approaches sin,AAAAAAAAEACABAAA,1673.28,0.1671895436513206
Electronics,audio,0.35,Bad aspirations mi,AAAAAAAAEAIEBAAA,9662.5,0.9654504718462452
Electronics,audio,80.69,Levels need total jobs. For example broken divisions used to remain further by a police; children swallow historica,AAAAAAAAEAIKAAAA,3485.16,0.3482276187797837
Electronics,audio,3.08,Materials can,AAAAAAAAEAKJAAAA,12496.68,1.24863395627545
Electronics,audio,6.94,"Local components can establish. Effective, general services feel. Relevant fans will not maintain narrow, new charts. English tools work both throughout a cultures; whole, annual shoulders he",AAAAAAAAEAMGAAAA,5376.66,0.5372211057135144
Electronics,audio,0.23,Certain guns ,AAAAAAAAEBNHAAAA,5564.95,0.5560345255679962
Electronics,audio,3.38,"Marks know always much valuable knees. As real classes use in a authorities. Afraid things represent then evident, wealthy materials. Things should us",AAAAAAAAECFEBAAA,11317.4,1.1308035363593993
Electronics,audio,0.54,"Past, rich years steal duties. Greek, keen forces buy j",AAAAAAAAECNPAAAA,7669.53,0.7663183810958792
Electronics,audio,1.72,Thinking students determine at a times. American events consider below in a,AAAAAAAAEDELAAAA,25161.06,2.5140240361347153
Electronics,audio,5.77,Women should keep once again in the men. Proud ties clear courses; never great kings will pay only systems. Similar companies conceive of course famous artists. Terms may concentrat,AAAAAAAAEEHFAAAA,7353.02,0.7346935708662229
Electronics,audio,2.86,"Police might hope hours; only years could try knees. Comfortable words materialise alone natural, academic letters; too other costs shou",AAAAAAAAEFDIAAAA,3185.0,0.3182364556616084
Electronics,audio,9.28,"Seemingly successful regulations use invariably also european researchers; necessary eggs go useful, basic ideas; still distinct efforts find hours. Bitter grou",AAAAAAAAEIMDBAAA,8135.92,0.8129187894337183
Electronics,audio,57.03,"Sweet words let with the sources. Leading, responsible",AAAAAAAAEJEFBAAA,6.62,0.0006614522249544263
Electronics,audio,2.28,"Certain years make subjects. There available facts can know. Light, deaf programmes should not support long in a days. Neat, excellent eyes must confer as partic",AAAAAAAAEJHAAAAA,2363.97,0.23620139217908082
Electronics,audio,4.21,"Single, unpleasant memb",AAAAAAAAEJIDBAAA,198.9,0.01987354192499024
Electronics,audio,2.47,National systems determine particular amounts,AAAAAAAAELGBAAAA,4724.16,0.4720250971360577
Electronics,audio,82.34,Really available mechanisms must increase more fi,AAAAAAAAELHDAAAA,1023.0,0.10221535137890907
Electronics,audio,7.99,Still colourful deaths might explore companies. All short th,AAAAAAAAELIHBAAA,2105.64,0.21038976781767946
Electronics,audio,2.1,"Eastern, accessible servants prevent never part-time guidelines. New, other poles should seem other years. Home large girls used to take eventually efficiently new aut",AAAAAAAAEMHDAAAA,1731.6,0.17301671793520915
Electronics,audio,7.89,Now other months ensure ladi,AAAAAAAAEMOCAAAA,4509.15,0.4505418882406724
Electronics,audio,8.37,Officers may,AAAAAAAAENHBBAAA,1186.17,0.11851884979972685
Electronics,audio,2.56,Chips shall slide companies. Grounds used to go doctors. There static grounds would allow books. Much personal police might help only. Windows try only. Now necessary opportunities must ease detail,AAAAAAAAENNNAAAA,4772.46,0.4768511005296074
Electronics,audio,2.23,"Still important trees resemble. New, professional hours go at a girls. General spots might occur p",AAAAAAAAEOHAAAAA,948.01,0.09472255646209149
Electronics,audio,0.69,Ra,AAAAAAAAFAAFAAAA,10643.98,1.0635172588172832
Electronics,audio,3.96,Plants should not observe over specific weeks. Conservatives form else to a conditions. Rarely obvious men get neighbo,AAAAAAAAFDLIBAAA,3515.4,0.3512491165566148
Electronics,audio,6.66,"Therefore evident elements ought to suppose now a little social efforts; actual, clear pp. stop false programmes. Surprising sales run downstream fe",AAAAAAAAFFGFBAAA,5904.13,0.5899244599577306
Electronics,audio,6.71,Firstly wide reductions respond now. In order dramatic buildings deal on a rocks. Clear parts descr,AAAAAAAAFGDEBAAA,718.81,0.07182152172499866
Electronics,audio,9.71,"Recent terms contact from a details. Prime, primary parents come ",AAAAAAAAFHPKAAAA,10483.58,1.047490531191499
Electronics,audio,4.19,"Acceptable, small gifts will try freely new concentrations. Basic conditions install other items. Areas prevent. ",AAAAAAAAFJMLAAAA,4648.0,0.4644153990314461
Electronics,audio,9.35,"Liberal, free ways choose reasonably very, po",AAAAAAAAFLBHBAAA,1121.4,0.11204720922415311
Electronics,audio,8.87,Eventually aggressive problems shall select often. Powerful claims acquire. Standa,AAAAAAAAGAEABAAA,3627.28,0.3624278589928537
Electronics,audio,6.93,"Good, exotic items want for a dates. Ages declin",AAAAAAAAGBLNAAAA,11324.9,1.1315529157683355
Electronics,audio,81.75,"Often gay fires may date. Collective factors view much multiple, french girl",AAAAAAAAGCACAAAA,6154.62,0.6149527330436573
Electronics,audio,6.12,"Often professional teeth will not wait. Even sacred pupils say still small, early times; now bad officials",AAAAAAAAGEBLAAAA,266.55,0.026632944193595517
Electronics,audio,4.88,"Home efficient operators manipulate nearly. Only attempts resolve occasionally years. Hitherto labour tiles make revolutionary, f",AAAAAAAAGEJDAAAA,6110.72,0.6105663655700169
Electronics,audio,0.23,"Councils arouse in a children. Clear processes may not advise otherwise with the councils. Sorry forms can complete then other, subsequent figur",AAAAAAAAGGKABAAA,4932.1,0.49280189104195254
Electronics,audio,3.67,"Lovely, recent provinces shall look less eyes.",AAAAAAAAGGNMAAAA,10482.97,1.047429581666239
Electronics,audio,7.62,Most absolute cases organise well leaders. Both effective programmes clear. Tomorr,AAAAAAAAGHOABAAA,6030.96,0.6025969653491158
Electronics,audio,3.01,Other children cannot sound. Spe,AAAAAAAAGIHHAAAA,4769.06,0.476511381864223
Electronics,audio,4.27,"Altogether central ages may communicate so dead, curious differences. Modern, late bones emphasise available, g",AAAAAAAAGIIMAAAA,1373.22,0.13720837225859778
Electronics,audio,3.58,Exactly able child,AAAAAAAAGINABAAA,4714.47,0.4710568989397121
Electronics,audio,0.22,"So spiritual products win necessary, residential terms; more powerful days should convey again ",AAAAAAAAGLFFBAAA,107.24,0.010715126375243605
Electronics,audio,6.75,"Usual, front men call now students; implicit, t",AAAAAAAAGLIKAAAA,3813.46,0.38103045344028796
Electronics,audio,4.44,Good pieces can introduce; cold terms ans,AAAAAAAAGLLFBAAA,7927.81,0.7921250095945543
Electronics,audio,1.1,"Visual situations will try for a studies. Fast, international rates could r",AAAAAAAAGMBFBAAA,3050.22,0.30476960809675074
Electronics,audio,3.48,"Young, rough seconds ensure following, other facts. Children can encourage so spanish arms. Occasions shall wonder much frequently wrong firms. Effects k",AAAAAAAAGNOBBAAA,5619.0,0.5614350531750636
Electronics,audio,3.85,Physical faces cause out of the parents. Total,AAAAAAAAGNOFAAAA,6770.55,0.6764947676231405
Electronics,audio,51.84,Subjects,AAAAAAAAGOHHAAAA,892.08,0.08913418441651731
Electronics,audio,4.11,"Russian beds used to come virtually on a benefits; steep, n",AAAAAAAAGPOGAAAA,7856.28,0.7849779283783928
Electronics,audio,3.46,"However severe children look even by a objects. Systems would justify protective, exceptional eyes; various m",AAAAAAAAHBFFBAAA,9537.27,0.9529378340620999
