i_current_price,i_item_desc,i_item_id
31.94,Politicians coul,AAAAAAAAAFIKAAAA
25.65,Faintly scientific charges ought to play more e,AAAAAAAADOCAAAAA
44.49,As social boys must rise. Then deaf humans can sense. Databases should not s,AAAAAAAAELIOAAAA
41.98,"Other, sm",AAAAAAAAFCGFBAAA
30.29,"Social, kind proposals would not satisfy so in a ",AAAAAAAAFCLNAAAA
17.1,"General, low initiatives create allegations; old",AAAAAAAAFNOEBAAA
43.97,Years used to give safely new houses. Writings define now. Unlike ,AAAAAAAAGPMIAAAA
